{
  "name": "learned",
  "version": "2026-10-10.ins500",
  "title": "Learned general classification (similarity- and navigation-optimized prototype)",
  "source": {
    "description": "Fitted by schemes/learned (learned-scheme build) to 10000 works of the benchmark corpus (corpus.jsonl sha256 7685685d0de25d6e8a614859783dcb5376d81e4fe336a65f22b550f4c7527b8d) on the k=20 kNN cosine graph (sha256 759d3b8461a9384d4359244c9fb42c2bc66496431e0f4681d33b7a59798ed35a). Objective: normalized Dasgupta cost + 0.005 x expected navigation cost (per-branch cost 1 bits + log2 fan-out); 2-12 child classes, at most 4 levels, leaf classes of at least 5 works; seed 20261010. Labels: written by hand from each class's c-TF-IDF terms and most central titles; the terms are the class vocabulary (source ctfidf).",
    "license": "CC0 1.0 (https://creativecommons.org/publicdomain/zero/1.0/)"
  },
  "code_grammar": "[0-9]{2}(\\.[0-9]{2})*",
  "classes": [
    {
      "code": "01",
      "label": "Computing, AI and engineering",
      "vocab": [
        {
          "term": "learning",
          "source": "ctfidf"
        },
        {
          "term": "language",
          "source": "ctfidf",
          "weight": 0.892459990823099
        },
        {
          "term": "training",
          "source": "ctfidf",
          "weight": 0.8074301440419072
        },
        {
          "term": "multi",
          "source": "ctfidf",
          "weight": 0.790337051814496
        },
        {
          "term": "reasoning",
          "source": "ctfidf",
          "weight": 0.6713595946250672
        },
        {
          "term": "llm",
          "source": "ctfidf",
          "weight": 0.6631624597578878
        },
        {
          "term": "generation",
          "source": "ctfidf",
          "weight": 0.6041936106592782
        },
        {
          "term": "agent",
          "source": "ctfidf",
          "weight": 0.5940305817632514
        },
        {
          "term": "control",
          "source": "ctfidf",
          "weight": 0.5872509796208703
        },
        {
          "term": "aware",
          "source": "ctfidf",
          "weight": 0.5709338965877233
        }
      ],
      "note": "5305 works in the fitting corpus. c-TF-IDF terms: learning, language, training, multi, reasoning, llm, generation, agent, control, aware."
    },
    {
      "code": "01.01",
      "label": "Language models, security and computing systems",
      "parent": "01",
      "vocab": [
        {
          "term": "llm",
          "source": "ctfidf"
        },
        {
          "term": "language",
          "source": "ctfidf",
          "weight": 0.9843192275502549
        },
        {
          "term": "training",
          "source": "ctfidf",
          "weight": 0.7965984085810934
        },
        {
          "term": "llms",
          "source": "ctfidf",
          "weight": 0.7624925698469532
        },
        {
          "term": "reasoning",
          "source": "ctfidf",
          "weight": 0.7458235188770798
        },
        {
          "term": "agent",
          "source": "ctfidf",
          "weight": 0.7368275202062692
        },
        {
          "term": "learning",
          "source": "ctfidf",
          "weight": 0.7216807549355173
        },
        {
          "term": "multi",
          "source": "ctfidf",
          "weight": 0.6817035505443967
        },
        {
          "term": "agents",
          "source": "ctfidf",
          "weight": 0.6587419424287667
        },
        {
          "term": "code",
          "source": "ctfidf",
          "weight": 0.5865142496269956
        }
      ],
      "note": "2555 works in the fitting corpus. c-TF-IDF terms: llm, language, training, llms, reasoning, agent, learning, multi, agents, code."
    },
    {
      "code": "01.01.01",
      "label": "Language, speech and LLM agents",
      "parent": "01.01",
      "vocab": [
        {
          "term": "language",
          "source": "ctfidf"
        },
        {
          "term": "reasoning",
          "source": "ctfidf",
          "weight": 0.9302159633175312
        },
        {
          "term": "llm",
          "source": "ctfidf",
          "weight": 0.9041919942001675
        },
        {
          "term": "llms",
          "source": "ctfidf",
          "weight": 0.7061094016378986
        },
        {
          "term": "agent",
          "source": "ctfidf",
          "weight": 0.6549321636797203
        },
        {
          "term": "agents",
          "source": "ctfidf",
          "weight": 0.6482691291951352
        },
        {
          "term": "human",
          "source": "ctfidf",
          "weight": 0.6123947131821771
        },
        {
          "term": "training",
          "source": "ctfidf",
          "weight": 0.5979135849467698
        },
        {
          "term": "speech",
          "source": "ctfidf",
          "weight": 0.5939839613536372
        },
        {
          "term": "text",
          "source": "ctfidf",
          "weight": 0.5398708083417414
        }
      ],
      "note": "1221 works in the fitting corpus. c-TF-IDF terms: language, reasoning, llm, llms, agent, agents, human, training, speech, text."
    },
    {
      "code": "01.01.01.01",
      "label": "Retrieval, knowledge graphs and recommendation",
      "parent": "01.01.01",
      "vocab": [
        {
          "term": "graph",
          "source": "ctfidf"
        },
        {
          "term": "retrieval",
          "source": "ctfidf",
          "weight": 0.977609932428327
        },
        {
          "term": "query",
          "source": "ctfidf",
          "weight": 0.9243560017719337
        },
        {
          "term": "llm",
          "source": "ctfidf",
          "weight": 0.7519521314624892
        },
        {
          "term": "recommendation",
          "source": "ctfidf",
          "weight": 0.686612055985554
        },
        {
          "term": "knowledge",
          "source": "ctfidf",
          "weight": 0.6086463789955127
        },
        {
          "term": "semantic",
          "source": "ctfidf",
          "weight": 0.5776955612568532
        },
        {
          "term": "llms",
          "source": "ctfidf",
          "weight": 0.54439583331371
        },
        {
          "term": "language",
          "source": "ctfidf",
          "weight": 0.530906002214333
        },
        {
          "term": "item",
          "source": "ctfidf",
          "weight": 0.5083621474262064
        }
      ],
      "note": "243 works in the fitting corpus. c-TF-IDF terms: graph, retrieval, query, llm, recommendation, knowledge, semantic, llms, language, item."
    },
    {
      "code": "01.01.01.02",
      "label": "LLM agents",
      "parent": "01.01.01",
      "vocab": [
        {
          "term": "agent",
          "source": "ctfidf"
        },
        {
          "term": "agents",
          "source": "ctfidf",
          "weight": 0.8896166796660644
        },
        {
          "term": "llm",
          "source": "ctfidf",
          "weight": 0.5765526990570555
        },
        {
          "term": "agentic",
          "source": "ctfidf",
          "weight": 0.4886317064369081
        },
        {
          "term": "user",
          "source": "ctfidf",
          "weight": 0.4812973282484337
        },
        {
          "term": "skill",
          "source": "ctfidf",
          "weight": 0.4622859863960553
        },
        {
          "term": "language",
          "source": "ctfidf",
          "weight": 0.4105914826526533
        },
        {
          "term": "scientific",
          "source": "ctfidf",
          "weight": 0.407248126599624
        },
        {
          "term": "memory",
          "source": "ctfidf",
          "weight": 0.3946470516115047
        },
        {
          "term": "multi",
          "source": "ctfidf",
          "weight": 0.3825136285662906
        }
      ],
      "note": "210 works in the fitting corpus. c-TF-IDF terms: agent, agents, llm, agentic, user, skill, language, scientific, memory, multi."
    },
    {
      "code": "01.01.01.03",
      "label": "LLM reasoning and reinforcement fine-tuning",
      "parent": "01.01.01",
      "vocab": [
        {
          "term": "reasoning",
          "source": "ctfidf"
        },
        {
          "term": "language",
          "source": "ctfidf",
          "weight": 0.5640307216868777
        },
        {
          "term": "training",
          "source": "ctfidf",
          "weight": 0.48764942661796973
        },
        {
          "term": "llm",
          "source": "ctfidf",
          "weight": 0.41086036564867745
        },
        {
          "term": "reward",
          "source": "ctfidf",
          "weight": 0.3980070351906203
        },
        {
          "term": "llms",
          "source": "ctfidf",
          "weight": 0.38976980264298716
        },
        {
          "term": "learning",
          "source": "ctfidf",
          "weight": 0.3635260608539452
        },
        {
          "term": "student",
          "source": "ctfidf",
          "weight": 0.3522792323225374
        },
        {
          "term": "teacher",
          "source": "ctfidf",
          "weight": 0.3294841506212818
        },
        {
          "term": "students",
          "source": "ctfidf",
          "weight": 0.3271362878601579
        }
      ],
      "note": "345 works in the fitting corpus. c-TF-IDF terms: reasoning, language, training, llm, reward, llms, learning, student, teacher, students."
    },
    {
      "code": "01.01.01.04",
      "label": "Language technology, society and bias",
      "parent": "01.01.01",
      "vocab": [
        {
          "term": "human",
          "source": "ctfidf"
        },
        {
          "term": "language",
          "source": "ctfidf",
          "weight": 0.9689012479919449
        },
        {
          "term": "social",
          "source": "ctfidf",
          "weight": 0.8890613287356512
        },
        {